{"$schema":"https://json-schema.org/draft/2020-12/schema","type":"object","additionalProperties":false,"required":["record_type","schema_version","notification_id","created_at","from_visitor_id","to_visitor_id","message_id","status","path","needs_human_action","summary","notes"],"properties":{"record_type":{"const":"notification"},"schema_version":{"$ref":"common.schema.json#/$defs/schema_version"},"notification_id":{"$ref":"common.schema.json#/$defs/artifact_id"},"created_at":{"$ref":"common.schema.json#/$defs/timestamp"},"from_visitor_id":{"type":"string","minLength":1},"to_visitor_id":{"type":"string","minLength":1},"message_id":{"type":"string","minLength":1},"status":{"enum":["needed","told_to_human","delivered_by_human","confirmed","cancelled"]},"path":{"$ref":"common.schema.json#/$defs/safe_path"},"needs_human_action":{"type":"boolean"},"summary":{"type":"string"},"notes":{"type":"string"}}}